{
  "schema_id": "orgsmith/review-sample@1",
  "slug": "fernhollow-partners",
  "docs": [
    {
      "doc_id": "d:0001",
      "path": "Engagements/Woods LLC/2020.05.31 - Engagement Letter - Woods LLC - EXECUTED.pdf",
      "genre": "engagement_letter",
      "format": "pdf",
      "date": "2020-05-31",
      "stratum": "longform",
      "words": 328
    },
    {
      "doc_id": "d:0002",
      "path": "Engagements/Woods LLC/2020.06.13 - Kickoff Memo - Valuation Analysis.docx",
      "genre": "kickoff_memo",
      "format": "docx",
      "date": "2020-06-13",
      "stratum": "planted-facts",
      "words": 224
    },
    {
      "doc_id": "d:0003",
      "path": "Engagements/Woods LLC/2020.07.10 - Email 1 - Valuation Analysis - Woods LLC.eml",
      "genre": "engagement_email",
      "format": "eml",
      "date": "2020-07-10",
      "stratum": "planted-facts",
      "words": 114
    },
    {
      "doc_id": "d:0004",
      "path": "Engagements/Woods LLC/2020.07.16 - Briefing Deck - Woods LLC.pptx",
      "genre": "briefing_deck",
      "format": "pptx",
      "date": "2020-07-16",
      "stratum": "planted-facts",
      "words": 128
    },
    {
      "doc_id": "d:0005",
      "path": "Engagements/Woods LLC/Meeting Minutes 2020-08-06 - Woods LLC.docx",
      "genre": "meeting_minutes",
      "format": "docx",
      "date": "2020-08-06",
      "stratum": "planted-facts",
      "words": 228
    },
    {
      "doc_id": "d:0006",
      "path": "Engagements/Woods LLC/2020.09.26 - Status Report - Woods LLC v2 FINAL.docx",
      "genre": "status_report",
      "format": "docx",
      "date": "2020-09-26",
      "stratum": "longform",
      "words": 270
    },
    {
      "doc_id": "d:0007",
      "path": "Firm/Firm Overview 2022 v3.docx",
      "genre": "company_overview",
      "format": "docx",
      "date": "2022-04-30",
      "stratum": "longform",
      "words": 278
    },
    {
      "doc_id": "d:0008",
      "path": "Engagements/Nguyen, Reynolds and Martinez/2022.05.18 - Engagement Letter - Nguyen, Reynolds and Martinez - EXECUTED.pdf",
      "genre": "engagement_letter",
      "format": "pdf",
      "date": "2022-05-18",
      "stratum": "longform",
      "words": 346
    },
    {
      "doc_id": "d:0009",
      "path": "Engagements/Nguyen, Reynolds and Martinez/2022.05.31 - Kickoff Memo - Transaction Readiness Review.docx",
      "genre": "kickoff_memo",
      "format": "docx",
      "date": "2022-05-31",
      "stratum": "planted-facts",
      "words": 242
    },
    {
      "doc_id": "d:0010",
      "path": "Engagements/Nguyen, Reynolds and Martinez/2022.06.27 - Email 1 - Transaction Readiness Review - Nguyen, Reynolds and Martinez.eml",
      "genre": "engagement_email",
      "format": "eml",
      "date": "2022-06-27",
      "stratum": "planted-facts",
      "words": 113
    },
    {
      "doc_id": "d:0011",
      "path": "Engagements/Nguyen, Reynolds and Martinez/2022.07.18 - Briefing Deck - Nguyen, Reynolds and Martinez.pptx",
      "genre": "briefing_deck",
      "format": "pptx",
      "date": "2022-07-18",
      "stratum": "planted-facts",
      "words": 144
    },
    {
      "doc_id": "d:0012",
      "path": "Engagements/Nguyen, Reynolds and Martinez/Meeting Minutes 2022-08-17 - Nguyen, Reynolds and Martinez.docx",
      "genre": "meeting_minutes",
      "format": "docx",
      "date": "2022-08-17",
      "stratum": "planted-facts",
      "words": 236
    },
    {
      "doc_id": "d:0013",
      "path": "Engagements/Woods LLC/2023.05.01 - Engagement Letter - Woods LLC - EXECUTED.pdf",
      "genre": "engagement_letter",
      "format": "pdf",
      "date": "2023-05-01",
      "stratum": "longform",
      "words": 294
    },
    {
      "doc_id": "d:0014",
      "path": "Engagements/Woods LLC/Meeting Minutes 2023-07-03 - Woods LLC.docx",
      "genre": "meeting_minutes",
      "format": "docx",
      "date": "2023-07-03",
      "stratum": "planted-facts",
      "words": 215
    },
    {
      "doc_id": "d:0016",
      "path": "Engagements/Nguyen, Reynolds and Martinez/2024.06.29 - Engagement Letter - Nguyen, Reynolds and Martinez - EXECUTED.pdf",
      "genre": "engagement_letter",
      "format": "pdf",
      "date": "2024-06-29",
      "stratum": "longform",
      "words": 266
    },
    {
      "doc_id": "d:0017",
      "path": "Engagements/Nguyen, Reynolds and Martinez/Meeting Minutes 2024-10-12 - Nguyen, Reynolds and Martinez.docx",
      "genre": "meeting_minutes",
      "format": "docx",
      "date": "2024-10-12",
      "stratum": "planted-facts",
      "words": 219
    },
    {
      "doc_id": "d:0018",
      "path": "Engagements/Nguyen, Reynolds and Martinez/2025.01.04 - Status Report - Nguyen, Reynolds and Martinez v2 FINAL.docx",
      "genre": "status_report",
      "format": "docx",
      "date": "2025-01-04",
      "stratum": "longform",
      "words": 244
    }
  ],
  "thin_strata": []
}
